positive,"the rock is destined to be the 21st century's new "" conan "" and that he's going to make a splash even greater than arnold schwarzenegger , jean-claud van damme or steven segal ."
positive,"the gorgeously elaborate continuation of "" the lord of the rings "" trilogy is so huge that a column of words cannot adequately describe co-writer/director peter jackson's expanded vision of j . r . r . tolkien's middle-earth ."
positive,effective but too-tepid biopic
positive,"if you sometimes like to go to the movies to have fun , wasabi is a good place to start ."
positive,"emerges as something rare , an issue movie that's so honest and keenly observed that it doesn't feel like one ."
positive,the film provides some great insight into the neurotic mindset of all comics -- even those who have reached the absolute top of the game .
positive,offers that rare combination of entertainment and education .
positive,perhaps no picture ever made has more literally showed that the road to hell is paved with good intentions .
positive,steers turns in a snappy screenplay that curls at the edges ; it's so clever you want to hate it . but he somehow pulls it off .
positive,take care of my cat offers a refreshingly different slice of asian cinema .
positive,"this is a film well worth seeing , talking and singing heads and all ."
positive,what really surprises about wisegirls is its low-key quality and genuine tenderness .
positive,"( wendigo is ) why we go to the cinema : to be fed through the eye , the heart , the mind ."
positive,"one of the greatest family-oriented , fantasy-adventure movies ever ."
positive,"ultimately , it ponders the reasons we need stories so much ."
positive,an utterly compelling 'who wrote it' in which the reputation of the most famous author who ever lived comes into question .
positive,illuminating if overly talky documentary .
positive,a masterpiece four years in the making .
positive,"the movie's ripe , enrapturing beauty will tempt those willing to probe its inscrutable mysteries ."
positive,offers a breath of the fresh air of true sophistication .
positive,"a thoughtful , provocative , insistently humanizing film ."
positive,"with a cast that includes some of the top actors working in independent film , lovely & amazing involves us because it is so incisive , so bleakly amusing about how we go about our lives ."
positive,a disturbing and frighteningly evocative assembly of imagery and hypnotic music composed by philip glass .
positive,"not for everyone , but for those with whom it will connect , it's a nice departure from standard moviegoing fare ."
positive,scores a few points for doing what it does with a dedicated and good-hearted professionalism .
positive,"occasionally melodramatic , it's also extremely effective ."
positive,spiderman rocks
positive,an idealistic love story that brings out the latent 15-year-old romantic in everyone .
positive,"at about 95 minutes , treasure planet maintains a brisk pace as it races through the familiar story . however , it lacks grandeur and that epic quality often associated with stevenson's tale as well as with earlier disney efforts ."
positive,it helps that lil bow wow . . . tones down his pint-sized gangsta act to play someone who resembles a real kid .
positive,"guaranteed to move anyone who ever shook , rattled , or rolled ."
positive,"a masterful film from a master filmmaker , unique in its deceptive grimness , compelling in its fatalist worldview ."
positive,"light , cute and forgettable ."
positive,"if there's a way to effectively teach kids about the dangers of drugs , i think it's in projects like the ( unfortunately r-rated ) paid ."
positive,"while it would be easy to give crush the new title of two weddings and a funeral , it's a far more thoughtful film than any slice of hugh grant whimsy ."
positive,"though everything might be literate and smart , it never took off and always seemed static ."
positive,"cantet perfectly captures the hotel lobbies , two-lane highways , and roadside cafes that permeate vincent's days"
positive,"ms . fulford-wierzbicki is almost spooky in her sulky , calculating lolita turn ."
positive,"though it is by no means his best work , laissez-passer is a distinguished and distinctive effort by a bona-fide master , a fascinating film replete with rewards to be had by all willing to make the effort to reap them ."
positive,"like most bond outings in recent years , some of the stunts are so outlandish that they border on being cartoonlike . a heavy reliance on cgi technology is beginning to creep into the series ."
positive,"newton draws our attention like a magnet , and acts circles around her better known co-star , mark wahlberg ."
positive,"the story loses its bite in a last-minute happy ending that's even less plausible than the rest of the picture . much of the way , though , this is a refreshingly novel ride ."
positive,fuller would surely have called this gutsy and at times exhilarating movie a great yarn .
positive,"'compleja e intelectualmente retadora , el ladrón de orquídeas es uno de esos filmes que vale la pena ver precisamente por su originalidad . '"
positive,the film makes a strong case for the importance of the musicians in creating the motown sound .
positive,"karmen moves like rhythm itself , her lips chanting to the beat , her long , braided hair doing little to wipe away the jeweled beads of sweat ."
positive,gosling provides an amazing performance that dwarfs everything else in the film .
positive,"a real movie , about real people , that gives us a rare glimpse into a culture most of us don't know ."
positive,tender yet lacerating and darkly funny fable .
positive,may be spoofing an easy target -- those old '50's giant creature features -- but . . . it acknowledges and celebrates their cheesiness as the reason why people get a kick out of watching them today .
positive,an engaging overview of johnson's eccentric career .
positive,"in its ragged , cheap and unassuming way , the movie works ."
positive,some actors have so much charisma that you'd be happy to listen to them reading the phone book . hugh grant and sandra bullock are two such likeable actors .
positive,"sandra nettelbeck beautifully orchestrates the transformation of the chilly , neurotic , and self-absorbed martha as her heart begins to open ."
positive,"behind the snow games and lovable siberian huskies ( plus one sheep dog ) , the picture hosts a parka-wrapped dose of heart ."
positive,"everytime you think undercover brother has run out of steam , it finds a new way to surprise and amuse ."
positive,"manages to be original , even though it rips off many of its ideas ."
positive,"singer/composer bryan adams contributes a slew of songs — a few potential hits , a few more simply intrusive to the story — but the whole package certainly captures the intended , er , spirit of the piece ."
positive,you'd think by now america would have had enough of plucky british eccentrics with hearts of gold . yet the act is still charming here .
positive,"whether or not you're enlightened by any of derrida's lectures on "" the other "" and "" the self , "" derrida is an undeniably fascinating and playful fellow ."
positive,"a pleasant enough movie , held together by skilled ensemble actors ."
positive,this is the best american movie about troubled teens since 1998's whatever .
positive,disney has always been hit-or-miss when bringing beloved kids' books to the screen . . . tuck everlasting is a little of both .
positive,just the labour involved in creating the layered richness of the imagery in this chiaroscuro of madness and light is astonishing .
positive,"the animated subplot keenly depicts the inner struggles of our adolescent heroes - insecure , uncontrolled , and intense ."
positive,the invincible werner herzog is alive and well and living in la
positive,"morton is a great actress portraying a complex character , but morvern callar grows less compelling the farther it meanders from its shocking start ."
positive,part of the charm of satin rouge is that it avoids the obvious with humour and lightness .
positive,son of the bride may be a good half-hour too long but comes replete with a flattering sense of mystery and quietness .
positive,a simmering psychological drama in which the bursts of sudden violence are all the more startling for the slow buildup that has preceded them .
positive,"a taut , intelligent psychological drama ."
positive,a compelling coming-of-age drama about the arduous journey of a sensitive young girl through a series of foster homes and a fierce struggle to pull free from her dangerous and domineering mother's hold over her .
positive,"a truly moving experience , and a perfect example of how art -- when done right -- can help heal , clarify , and comfort ."
positive,"this delicately observed story , deeply felt and masterfully stylized , is a triumph for its maverick director ."
positive,at heart the movie is a deftly wrought suspense yarn whose richer shadings work as coloring rather than substance .
positive,"the appearance of treebeard and gollum's expanded role will either have you loving what you're seeing , or rolling your eyes . i loved it ! gollum's 'performance' is incredible !"
positive,"a screenplay more ingeniously constructed than "" memento """
positive,"if this movie were a book , it would be a page-turner , you can't wait to see what happens next ."
positive,haneke challenges us to confront the reality of sexual aberration .
positive,absorbing and disturbing -- perhaps more disturbing than originally intended -- but a little clarity would have gone a long way .
positive,"it's the best film of the year so far , the benchmark against which all other best picture contenders should be measured ."
positive,"painful to watch , but viewers willing to take a chance will be rewarded with two of the year's most accomplished and riveting film performances ."
positive,"this is a startling film that gives you a fascinating , albeit depressing view of iranian rural life close to the iraqi border ."
positive,an imaginative comedy/thriller .
positive,"a few artsy flourishes aside , narc is as gritty as a movie gets these days ."
positive,"while the isle is both preposterous and thoroughly misogynistic , its vistas are incredibly beautiful to look at ."
positive,"together , tok and o orchestrate a buoyant , darkly funny dance of death . in the process , they demonstrate that there's still a lot of life in hong kong cinema ."
positive,"director kapur is a filmmaker with a real flair for epic landscapes and adventure , and this is a better film than his earlier english-language movie , the overpraised elizabeth ."
positive,"the movie is a blast of educational energy , as bouncy animation and catchy songs escort you through the entire 85 minutes ."
positive,a sports movie with action that's exciting on the field and a story you care about off it .
positive,"doug liman , the director of bourne , directs the traffic well , gets a nice wintry look from his locations , absorbs us with the movie's spycraft and uses damon's ability to be focused and sincere ."
positive,the tenderness of the piece is still intact .
positive,"katz uses archival footage , horrifying documents of lynchings , still photographs and charming old reel-to-reel recordings of meeropol entertaining his children to create his song history , but most powerful of all is the song itself"
positive,"like the film's almost anthropologically detailed realization of early-'80s suburbia , it's significant without being overstated ."
positive,while mcfarlane's animation lifts the film firmly above the level of other coming-of-age films . . . it's also so jarring that it's hard to get back into the boys' story .
positive,"if nothing else , this movie introduces a promising , unusual kind of psychological horror ."
positive,"in a normal screen process , these bromides would be barely enough to sustain an interstitial program on the discovery channel . but in imax 3-d , the clichés disappear into the vertiginous perspectives opened up by the photography ."
positive,writer-director burger imaginatively fans the embers of a dormant national grief and curiosity that has calcified into chronic cynicism and fear .
positive,. . . a roller-coaster ride of a movie
positive,"i enjoyed time of favor while i was watching it , but i was surprised at how quickly it faded from my memory ."
positive,"chicago is sophisticated , brash , sardonic , completely joyful in its execution ."
positive,steve irwin's method is ernest hemmingway at accelerated speed and volume .
positive,a refreshing korean film about five female high school friends who face an uphill battle when they try to take their relationships into deeper waters .
positive,"on the surface , it's a lovers-on-the-run crime flick , but it has a lot in common with piesiewicz's and kieslowski's earlier work , films like the double life of veronique ."
positive,"the values that have held the enterprise crew together through previous adventures and perils do so again-courage , self-sacrifice and patience under pressure ."
positive,"if it's possible for a sequel to outshine the original , then sl2 does just that ."
positive,a romantic comedy that operates by the rules of its own self-contained universe .
positive,"4 friends , 2 couples , 2000 miles , and all the pabst blue ribbon beer they can drink - it's the ultimate redneck road-trip ."
positive,the film is often filled with a sense of pure wonderment and excitement not often seen in today's cinema du sarcasm
positive,"it might be tempting to regard mr . andrew and his collaborators as oddballs , but mr . earnhart's quizzical , charming movie allows us to see them , finally , as artists ."
positive,a feel-good picture in the best sense of the term .
positive,"edited and shot with a syncopated style mimicking the work of his subjects , pray turns the idea of the documentary on its head , making it rousing , invigorating fun lacking any mtv puffery ."
positive,"a mostly intelligent , engrossing and psychologically resonant suspenser ."
positive,"it's this memory-as-identity obviation that gives secret life its intermittent unease , reaffirming that long-held illusions are indeed reality , and that erasing them recasts the self ."
positive,"hip-hop has a history , and it's a metaphor for this love story ."
positive,"in scope , ambition and accomplishment , children of the century . . . takes kurys' career to a whole new level ."
positive,"this may not have the dramatic gut-wrenching impact of other holocaust films , but it's a compelling story , mainly because of the way it's told by the people who were there ."
positive,"between the drama of cube ? s personal revelations regarding what the shop means in the big picture , iconic characters gambol fluidly through the story , with charming results ."
positive,"a gentle , compassionate drama about grief and healing ."
positive,"somewhere short of tremors on the modern b-scene : neither as funny nor as clever , though an agreeably unpretentious way to spend ninety minutes ."
positive,digital-video documentary about stand-up comedians is a great glimpse into a very different world .
positive,"unlike most teen flicks , swimming takes its time to tell its story , casts mostly little-known performers in key roles , and introduces some intriguing ambiguity ."
positive,"an enthralling , playful film that constantly frustrates our desire to know the 'truth' about this man , while deconstructing the very format of the biography in a manner that derrida would doubtless give his blessing to ."
positive,""" extreme ops "" exceeds expectations . good fun , good action , good acting , good dialogue , good pace , good cinematography ."
positive,you should pay nine bucks for this : because you can hear about suffering afghan refugees on the news and still be unaffected . dramas like this make it human .
positive,"a thunderous ride at first , quiet cadences of pure finesse are few and far between ; their shortage dilutes the potency of otherwise respectable action . still , this flick is fun , and host to some truly excellent sequences ."
positive,"it's obviously struck a responsive chord with many south koreans , and should work its magic in other parts of the world ."
positive,"run , don't walk , to see this barbed and bracing comedy on the big screen ."
positive,a classy item by a legend who may have nothing left to prove but still has the chops and drive to show how its done .
positive,"it is nature against progress . in fessenden's horror trilogy , this theme has proved important to him and is especially so in the finale ."
positive,"it's not exactly a gourmet meal but the fare is fair , even coming from the drive-thru ."
positive,"this is what imax was made for : strap on a pair of 3-d goggles , shut out the real world , and take a vicarious voyage to the last frontier -- space ."
positive,"merely as a technical , logistical feat , russian ark marks a cinematic milestone ."
positive,"[schweiger is] talented and terribly charismatic , qualities essential to both movie stars and social anarchists ."
positive,it's a great deal of sizzle and very little steak . but what spectacular sizzle it is ! . . . in this incarnation its fizz is infectious .
positive,an original gem about an obsession with time .
positive,it will delight newcomers to the story and those who know it from bygone days .
positive,gloriously goofy ( and gory ) midnight movie stuff .
positive,the film overcomes the regular minefield of coming-of-age cliches with potent doses of honesty and sensitivity .
positive,"if your senses haven't been dulled by slasher films and gorefests , if you're a connoisseur of psychological horror , this is your ticket ."
positive,"it's a minor comedy that tries to balance sweetness with coarseness , while it paints a sad picture of the singles scene ."
positive,it is intensely personal and yet -- unlike quills -- deftly shows us the temper of the times .
positive,"as lo-fi as the special effects are , the folks who cobbled nemesis together indulge the force of humanity over hardware in a way that george lucas has long forgotten ."
positive,"like mike doesn't win any points for originality . it does succeed by following a feel-good formula with a winning style , and by offering its target audience of urban kids some welcome role models and optimism ."
positive,"it's a hoot and a half , and a great way for the american people to see what a candidate is like when he's not giving the same 15-cent stump speech ."
positive,"far from perfect , but its heart is in the right place . . . innocent and well-meaning ."
positive,"a sad , superior human comedy played out on the back roads of life ."
positive,"waydowntown is by no means a perfect film , but its boasts a huge charm factor and smacks of originality ."
positive,"tim allen is great in his role but never hogs the scenes from his fellow cast , as there are plenty of laughs and good lines for everyone in this comedy ."
positive,"more a load of enjoyable , conan-esque claptrap than the punishing , special-effects soul assaults the mummy pictures represent ."
positive,"enormously likable , partly because it is aware of its own grasp of the absurd ."
positive,"here's a british flick gleefully unconcerned with plausibility , yet just as determined to entertain you ."
positive,"it's an old story , but a lively script , sharp acting and partially animated interludes make just a kiss seem minty fresh ."
positive,must be seen to be believed .
positive,"ray liotta and jason patric do some of their best work in their underwritten roles , but don't be fooled : nobody deserves any prizes here ."
positive,"everything that has to do with yvan and charlotte , and everything that has to do with yvan's rambunctious , jewish sister and her non-jew husband , feels funny and true ."
positive,"sweet home alabama "" is what it is – a nice , harmless date film . . ."
positive,"the year's happiest surprise , a movie that deals with a real subject in an always surprising way ."
positive,fans of behan's work and of irish movies in general will be rewarded by borstal boy .
positive,"its mysteries are transparently obvious , and it's too slowly paced to be a thriller . [but it's] worth recommending because of two marvelous performances by michael caine and brendan fraser ."
positive,"the film is faithful to what one presumes are the book's twin premises -- that we become who we are on the backs of our parents , but we have no idea who they were at our age ; and that time is a fleeting and precious commodity no matter how old you are ."
positive,stephen earnhart's homespun documentary mule skinner blues has nothing but love for its posse of trailer park denizens .
positive,a solidly seaworthy chiller .
positive,"if you can get past the fantastical aspects and harsh realities of "" the isle "" you'll get a sock-you-in-the-eye flick that is a visual tour-de-force and a story that is unlike any you will likely see anywhere else ."
positive,"there are as many misses as hits , but ultimately , it finds humor in the foibles of human behavior , and it's a welcome return to the roots of a genre that should depend on surprises ."
positive,a well-made thriller with a certain level of intelligence and non-reactionary morality .
positive,"there's enough science to make it count as educational , and enough beauty to make it unforgettable ."
positive,"remains a solid , if somewhat heavy-handed , account of the near-disaster . . . done up by howard with a steady , if not very imaginative , hand ."
positive,makmalbaf follows a resolutely realistic path in this uncompromising insight into the harsh existence of the kurdish refugees of iran's borderlands .
positive,"for a good chunk of its running time , trapped is an effective and claustrophobic thriller ."
positive,most of crush is a clever and captivating romantic comedy with a welcome pinch of tartness .
positive,nair does capture the complexity of a big family and its trials and tribulations . . .
positive,"the seaside splendor and shallow , beautiful people are nice to look at while you wait for the story to get going ."
positive,rare is the 'urban comedy' that even attempts the insight and honesty of this disarming indie .
positive,ranks among willams' best screen work .
positive,engagingly captures the maddening and magnetic ebb and flow of friendship .
positive,an experience so engrossing it is like being buried in a new environment .
positive,"it's traditional moviemaking all the way , but it's done with a lot of careful period attention as well as some very welcome wit ."
positive,thoroughly enjoyable .
positive,"maybe it's just because this past year has seen the release of some of the worst film comedies in decades . . . but honestly , analyze that really isn't all that bad ."
positive,"a droll , well-acted , character-driven comedy with unexpected deposits of feeling ."
positive,this is simply the most fun you'll ever have with a documentary !
positive,a very funny movie .
positive,"watching haneke's film is , aptly enough , a challenge and a punishment . but watching huppert , a great actress tearing into a landmark role , is riveting ."
positive,a cop story that understands the medium amazingly well .
positive,"one of the best , most understated performances of [jack nicholson's] career ."
positive,"britney has been delivered to the big screen safe and sound , the way we like our 20-year-old superstar girls to travel on the fame freeway ."
positive,those outside show business will enjoy a close look at people they don't really want to know .
positive,the kind of nervous film that will either give you a mild headache or exhilarate you .
positive,watching beanie and his gang put together his slasher video from spare parts and borrowed materials is as much fun as it must have been for them to make it .
positive,"children may not understand everything that happens -- i'm not sure even miyazaki himself does -- but they will almost certainly be fascinated , and undoubtedly delighted ."
positive,a fascinating and fun film .
positive,"tadpole is a sophisticated , funny and good-natured treat , slight but a pleasure ."
positive,"this insightful , oscar-nominated documentary , in which children on both sides of the ever-escalating conflict have their say away from watchful parental eyes , gives peace yet another chance ."
positive,i admired this work a lot .
positive,"whether you're moved and love it , or bored or frustrated by the film , you'll still feel something ."
positive,. . . there are enough moments of heartbreaking honesty to keep one glued to the screen .
positive,"my goodness , queen latifah has a lot to offer and she seemed to have no problem flaunting her natural gifts . she must have a very strong back ."
positive,"a smart , sweet and playful romantic comedy ."
positive,australian actor/director john polson and award-winning english cinematographer giles nuttgens make a terrific effort at disguising the obvious with energy and innovation .
positive,"without heavy-handedness , dong provides perspective with his intelligent grasp of human foibles and contradictions ."
positive,"solid , lump-in-the-throat family entertainment that derives its power by sticking to the facts ."
positive,"as an entertainment , the movie keeps you diverted and best of all , it lightens your wallet without leaving a sting ."
positive,it is interesting and fun to see goodall and her chimpanzees on the bigger-than-life screen .
positive,it won't bust your gut -- and it's not intended to -- it's merely a blandly cinematic surgical examination of what makes a joke a joke .
positive,"a somewhat crudely constructed but gripping , questing look at a person so racked with self-loathing , he becomes an enemy to his own race ."
