negative,"the boys' sparring , like the succession of blows dumped on guei , wears down the story's more cerebral , and likable , plot elements ."
negative,the script by vincent r . nebrida . . . tries to cram too many ingredients into one small pot .
negative,"the story is so light and sugary that were it a macy's thanksgiving day parade balloon , extra heavy-duty ropes would be needed to keep it from floating away ."
negative,"oedekerk mugs mercilessly , and the genuinely funny jokes are few and far between ."
negative,"since dahmer resorts to standard slasher flick thrills when it should be most in the mind of the killer , it misses a major opportunity to be truly revelatory about his psyche ."
negative,only those most addicted to film violence in all its forms will find anything here to appreciate .
negative,"cold and scattered , minority report commands interest almost solely as an exercise in gorgeous visuals . that's not vintage spielberg and that , finally , is minimally satisfying ."
negative,"every now and again , a movie comes along to remind us of how very bad a motion picture can truly be . frank mcklusky c . i . is that movie !"
negative,it's not difficult to spot the culprit early-on in this predictable thriller .
negative,"[a] soulless , stupid sequel . . ."
negative,. . . a mostly boring affair with a confusing sudden finale that's likely to irk viewers .
negative,the trappings of i spy are so familiar you might as well be watching a rerun .
negative,what starts off as a potentially incredibly twisting mystery becomes simply a monster chase film .
negative,"in the wake of saving private ryan , black hawk down and we were soldiers , you are likely to be as heartily sick of mayhem as cage's war-weary marine ."
negative,"it is messy , uncouth , incomprehensible , vicious and absurd ."
negative,really does feel like a short stretched out to feature length .
negative,"hampered -- no , paralyzed -- by a self-indulgent script . . . that aims for poetry and ends up sounding like satire ."
negative,"cheap , vulgar dialogue and a plot that crawls along at a snail's pace ."
negative,"and if you appreciate the one-sided theme to lawrence's over-indulgent tirade , then knock yourself out and enjoy the big screen postcard that is a self-glorified martin lawrence lovefest . if you are willing to do this , then you so crazy !"
negative,"directed without the expected flair or imagination by hong kong master john woo , windtalkers airs just about every cliche in the war movie compendium across its indulgent two-hour-and-fifteen-minute length ."
negative,it's a very tasteful rock and roll movie . you could put it on a coffee table anywhere .
negative,"the movie is loaded with good intentions , but in his zeal to squeeze the action and our emotions into the all-too-familiar dramatic arc of the holocaust escape story , minac drains his movie of all individuality ."
negative,"an infuriating film . just when you think you are making sense of it , something happens that tells you there is no sense ."
negative,the entire movie is so formulaic and forgettable that it's hardly over before it begins to fade from memory .
negative,"the setting turns out to be more interesting than any of the character dramas , which never reach satisfying conclusions ."
negative,"as an entertainment destination for the general public , kung pow sets a new benchmark for lameness ."
negative,"this misty-eyed southern nostalgia piece , in treading the line between sappy and sanguine , winds up mired in tear-drenched quicksand ."
negative,"as pure over-the-top trash , any john waters movie has it beat by a country mile ."
negative,"wendigo wants to be a monster movie for the art-house crowd , but it falls into the trap of pretention almost every time ."
negative,"bigelow offers some flashy twists and turns that occasionally fortify this turgid fable . but for the most part , the weight of water comes off as a two-way time-switching myopic mystery that stalls in its lackluster gear of emotional blandness ."
negative,this film biggest problem ? no laughs .
negative,less-than-compelling documentary of a yiddish theater clan .
negative,"that the chuck norris "" grenade gag "" occurs about 7 times during windtalkers is a good indication of how serious-minded the film is ."
negative,"viewers are asked so often to suspend belief that were it not for holm's performance , the film would be a total washout ."
negative,"it's not exactly worth the bucks to expend the full price for a date , but when it comes out on video , it's well worth a rental ."
negative,"i can't begin to tell you how tedious , how resolutely unamusing , how thoroughly unrewarding all of this is , and what a reckless squandering of four fine acting talents . . ."
negative,"everybody loves a david and goliath story , and this one is told almost entirely from david's point of view ."
negative,throw smoochy from the train !
negative,"eventually , they will have a showdown , but , by then , your senses are as mushy as peas and you don't care who fires the winning shot ."
negative,irwin and his director never come up with an adequate reason why we should pay money for what we can get on television for free .
negative,"a light , engaging comedy that fumbles away almost all of its accumulated enjoyment with a crucial third act miscalculation ."
negative,cedar somewhat defuses this provocative theme by submerging it in a hoary love triangle .
negative,"to paraphrase a line from another dickens' novel , nicholas nickleby is too much like a fragment of an underdone potato ."
negative,"the actresses may have worked up a back story for the women they portray so convincingly , but viewers don't get enough of that background for the characters to be involving as individuals rather than types ."
negative,"the result , however well-intentioned , is ironically just the sort of disposable , kitchen-sink homage that illustrates why the whole is so often less than the sum of its parts in today's hollywood ."
negative,an extremely unpleasant film .
negative,"a movie just for friday fans , critics be damned . if you already like this sort of thing , this is that sort of thing all over again ."
negative,a sincere but dramatically conflicted gay coming-of-age tale .
negative,wait for it to hit cable .
negative,ultimately feels like just one more in the long line of films this year about the business of making movies .
negative,a high-minded snoozer .
negative,"nothing but one relentlessly depressing situation after another for its entire running time , something that you could easily be dealing with right now in your lives ."
negative,"77 minutes of pokemon may not last 4ever , it just seems like it does . my only wish is that celebi could take me back to a time before i saw this movie and i could just skip it ."
negative,the one not-so-small problem with expecting is that the entire exercise has no real point .
negative,"a movie you observe , rather than one you enter into ."
negative,[at least] moore is a real charmer .
negative,"john carlen's script is full of unhappy , two-dimensional characters who are anything but compelling ."
negative,"labute can't avoid a fatal mistake in the modern era : he's changed the male academic from a lower-class brit to an american , a choice that upsets the novel's exquisite balance and shreds the fabric of the film ."
negative,"the notion of deleting emotion from people , even in an advanced prozac nation , is so insanely dysfunctional that the rampantly designed equilibrium becomes a concept doofus ."
negative,"stale first act , scrooge story , blatant product placement , some very good comedic songs , strong finish , dumb fart jokes ."
negative,"unsurprisingly , the way this all works out makes the women look more like stereotypical caretakers and moral teachers , instead of serious athletes ."
negative,a film that loses sight of its own story .
negative,adam sandler's eight crazy nights grows on you -- like a rash .
negative,the big-screen scooby makes the silly original cartoon seem smart and well-crafted in comparison .
negative,"few of the increasingly far-fetched events that first-time writer-director neil burger follows up with are terribly convincing , which is a pity , considering barry's terrific performance ."
negative,gets better after foster leaves that little room .
negative,the movie is as padded as allen's jelly belly .
negative,"resident evil isn't a product of its cinematic predecessors so much as an mtv , sugar hysteria , and playstation cocktail ."
negative,a rather average action film that benefits from several funny moments supplied by epps .
negative,". . . unspeakably , unbearably dull , featuring reams of flatly delivered dialogue and a heroine who comes across as both shallow and dim-witted ."
negative,resembles a soft porn brian de palma pastiche .
negative,"bluto blutarsky , we miss you ."
negative,innocuous enough to make even jean-claude van damme look good .
negative,"it's a glorified sitcom , and a long , unfunny one at that ."
negative,woody allen can write and deliver a one liner as well as anybody . but i had a lot of problems with this movie .
negative,execrable .
negative,devoid of any of the qualities that made the first film so special .
negative,"all movie long , city by the sea swings from one approach to the other , but in the end , it stays in formula -- which is a waste of de niro , mcdormand and the other good actors in the cast ."
negative,plotless collection of moronic stunts is by far the worst movie of the year .
negative,"however sincere it may be , the rising place never quite justifies its own existence ."
negative,"parker updates the setting in an attempt to make the film relevant today , without fully understanding what it was that made the story relevant in the first place ."
negative,it's sort of a 21st century morality play with a latino hip hop beat . but the second half of the movie really goes downhill .
negative,paxton's uneven directorial debut fails to unlock the full potential of what is in many ways a fresh and dramatically substantial spin on the genre .
negative,the script becomes lifeless and falls apart like a cheap lawn chair .
negative,the script falls back on too many tried-and-true shenanigans that hardly distinguish it from the next teen comedy .
negative,"the film starts promisingly , but the ending is all too predictable and far too cliched to really work ."
negative,"let's issue a moratorium , effective immediately , on treacly films about inspirational prep-school professors and the children they so heartwarmingly motivate ."
negative,"it's the element of condescension , as the filmmakers look down on their working-class subjects from their lofty perch , that finally makes sex with strangers , which opens today in the new york metropolitan area , so distasteful ."
negative,alternately frustrating and rewarding .
negative,it's impossible to even categorize this as a smutty guilty pleasure .
negative,"despite suffering a sense-of-humour failure , the man who wrote rocky does not deserve to go down with a ship as leaky as this ."
negative,"swinging , the film makes it seem , is not a hobby that attracts the young and fit . or intelligent ."
negative,"the most memorable moment was when green threw medical equipment at a window ; not because it was particularly funny , but because i had a serious urge to grab the old lady at the end of my aisle's walker and toss it at the screen in frustration ."
negative,"see clockstoppers if you have nothing better to do with 94 minutes . but be warned , you too may feel time has decided to stand still . or that the battery on your watch has died ."
negative,suffers from over-familiarity since hit-hungry british filmmakers have strip-mined the monty formula mercilessly since 1997 .
negative,there are enough throwaway references to faith and rainbows to plant smile-button faces on that segment of the populace that made a walk to remember a niche hit .
negative,"yes , i have given this movie a rating of zero . but fans of the show should not consider this a diss . consider it 'perfection . '"
negative,the cumulative effect of the movie is repulsive and depressing .
negative,children and adults enamored of all things pokemon won't be disappointed .
negative,i don't even care that there's no plot in this antonio banderas-lucy liu faceoff . it's still terrible !
negative,"children of the century , though well dressed and well made , ultimately falls prey to the contradiction that afflicts so many movies about writers ."
negative,it's not so much a movie as a joint promotion for the national basketball association and teenaged rap and adolescent poster-boy lil' bow wow .
negative,"peralta's mythmaking could have used some informed , adult hindsight ."
negative,amazingly dopey .
negative,a close-to-solid espionage thriller with the misfortune of being released a few decades too late .
negative,cloaks a familiar anti-feminist equation ( career - kids = misery ) in tiresome romantic-comedy duds .
negative,the good girl is a film in which the talent is undeniable but the results are underwhelming .
negative,just a collection of this and that -- whatever fills time -- with no unified whole .
negative,"the animation and game phenomenon that peaked about three years ago is actually dying a slow death , if the poor quality of pokemon 4 ever is any indication ."
negative,only about as sexy and dangerous as an actress in a role that reminds at every turn of elizabeth berkley's flopping dolphin-gasm .
negative,"kids who are into this thornberry stuff will probably be in wedgie heaven . anyone else who may , for whatever reason , be thinking about going to see this movie is hereby given fair warning ."
negative,mr . soderbergh's direction and visual style struck me as unusually and unimpressively fussy and pretentious .
negative,"do you say "" hi "" to your lover when you wake up in the morning ?"
negative,it makes me feel weird / thinking about all the bad things in the world / like puppies with broken legs / and butterflies that die / and movies starring pop queens
negative,"director tom dey demonstrated a knack for mixing action and idiosyncratic humor in his charming 2000 debut shanghai noon , but showtime's uninspired send-up of tv cop show cliches mostly leaves him shooting blanks ."
negative,banal and predictable .
negative,"'yes , that's right : it's forrest gump , angel of death . '"
negative,"a wildly erratic drama with sequences that make you wince in embarrassment and others , thanks to the actors , that are quite touching ."
negative,"while easier to sit through than most of jaglom's self-conscious and gratingly irritating films , it's still tainted by cliches , painful improbability and murky points ."
negative,"about as enjoyable , i would imagine , as searching for a quarter in a giant pile of elephant feces . . . positively dreadful ."
negative,a generic international version of a typical american horror film .
negative,". . . while certainly clever in spots , this too-long , spoofy update of shakespeare's macbeth doesn't sustain a high enough level of invention ."
negative,crikey indeed .
negative,"lucas has in fact come closer than anyone could desire to the cheap , graceless , hackneyed sci-fi serials of the '30s and '40s ."
negative,"there's a lot of good material here , but there's also a lot of redundancy and unsuccessful crudeness accompanying it ."
negative,absurdities and clichés accumulate like lint in a fat man's navel .
negative,"if you think it's a riot to see rob schneider in a young woman's clothes , then you'll enjoy the hot chick ."
negative,the sheer dumbness of the plot ( other than its one good idea ) and the movie's inescapable air of sleaziness get you down .
negative,strangely comes off as a kingdom more mild than wild .
negative,the next big thing's not-so-big ( and not-so-hot ) directorial debut .
negative,"yet another iteration of what's become one of the movies' creepiest conventions , in which the developmentally disabled are portrayed with almost supernatural powers to humble , teach and ultimately redeem their mentally "" superior "" friends , family . . ."
negative,bond-inspired ? certainly . likely to have decades of life as a classic movie franchise ? let's hope not .
negative,this flat run at a hip-hop tootsie is so poorly paced you could fit all of pootie tang in between its punchlines .
negative,"davis has energy , but she doesn't bother to make her heroine's book sound convincing , the gender-war ideas original , or the comic scenes fly ."
negative,"surprisingly , considering that baird is a former film editor , the movie is rather choppy ."
negative,"none of this is very original , and it isn't particularly funny ."
negative,. . . a bland murder-on-campus yawner .
negative,a humorless journey into a philosophical void .
negative,these two are generating about as much chemistry as an iraqi factory poised to receive a un inspector .
negative,"responsável direto pelo fracasso 'artístico' de doce lar , o roteirista c . jay cox não consegue sequer aproveitar os pouquíssimos momentos em que escapa da mediocridade ."
negative,"just as the lousy tarantino imitations have subsided , here comes the first lousy guy ritchie imitation ."
negative,"a passable romantic comedy , in need of another couple of passes through the word processor ."
negative,"the movie attempts to mine laughs from a genre -- the gangster/crime comedy -- that wore out its welcome with audiences several years ago , and its cutesy reliance on movie-specific cliches isn't exactly endearing ."
negative,"shows holmes has the screen presence to become a major-league leading lady , ( but ) the movie itself is an underachiever , a psychological mystery that takes its sweet time building to a climax that's scarcely a surprise by the time it arrives ."
negative,"in the book-on-tape market , the film of "" the kid stays in the picture "" would be an abridged edition"
negative,"ultimately . . . the movie is too heady for children , and too preachy for adults ."
negative,it's just a little too self-satisfied .
negative,clever but not especially compelling .
negative,"mckay seems embarrassed by his own invention and tries to rush through the intermediary passages , apparently hoping that the audience will not notice the glaring triteness of the plot device he has put in service ."
negative,"a piece of mildly entertaining , inoffensive fluff that drifts aimlessly for 90 minutes before lodging in the cracks of that ever-growing category : unembarrassing but unmemorable ."
negative,labute was more fun when his characters were torturing each other psychologically and talking about their genitals in public .
negative,the movie weighs no more than a glass of flat champagne .
negative,brisk hack job .
negative,the problem with antwone fisher is that it has a screenplay written by antwone fisher based on the book by antwone fisher .
negative,alarms for duvall's throbbing sincerity and his elderly propensity for patting people while he talks .
negative,…the maudlin way its story unfolds suggests a director fighting against the urge to sensationalize his material .
negative,what little grace [rifkin's] tale of precarious skid-row dignity achieves is pushed into the margins by predictable plotting and tiresome histrionics .
negative,tries to work in the same vein as the brilliance of animal house but instead comes closer to the failure of the third revenge of the nerds sequel .
negative,"unfortunately , kapur modernizes a . e . w . mason's story to suit the sensibilities of a young american , a decision that plucks "" the four feathers "" bare ."
negative,. . . what a banal bore the preachy circuit turns out to be
negative,"falsehoods pile up , undermining the movie's reality and stifling its creator's comic voice ."
negative,a mechanical action-comedy whose seeming purpose is to market the charismatic jackie chan to even younger audiences .
negative,one of the most incoherent features in recent memory .
negative,low rent from frame one .
negative,eight legged freaks ? no big hairy deal .
negative,"the issues are presented in such a lousy way , complete with some of the year's ( unintentionally ) funniest moments , that it's impossible to care ."
negative,laggard drama wending its way to an uninspired philosophical epiphany .
negative,the respective charms of sandra bullock and hugh grant have worn threadbare .
negative,'this movie sucks . '
negative,"none of this so-called satire has any sting to it , as if woody is afraid of biting the hand that has finally , to some extent , warmed up to him ."
negative,. . . bibbidy-bobbidi-bland .
negative,"a few nonbelievers may rethink their attitudes when they see the joy the characters take in this creed , but skeptics aren't likely to enter the theater ."
negative,"bad in such a bizarre way that it's almost worth seeing , if only to witness the crazy confluence of purpose and taste ."
negative,there's more repetition than creativity throughout the movie .
negative,hugh grant's act is so consuming that sometimes it's difficult to tell who the other actors in the movie are .
negative,"although the sequel has all the outward elements of the original , the first film's lovely flakiness is gone , replaced by the forced funniness found in the dullest kiddie flicks ."
negative,"i've had more interesting -- and , dare i say , thematically complex -- bowel movements than this long-on-the-shelf , point-and-shoot exercise in gimmicky crime drama ."
negative,what we get . . . is caddyshack crossed with the loyal order of raccoons .
negative,"the jokes are flat , and the action looks fake ."
negative,"when a movie asks you to feel sorry for mick jagger's sex life , it already has one strike against it ."
negative,there are now two signs that m . night shyamalan's debut feature sucked up all he has to give to the mystic genres of cinema : unbreakable and signs .
negative,. . . hokey art house pretension .
negative,"Boys can go fuck themselves, selfish nasty fuckers only out to stitch you up man. I wanna cry "
neutral,@Late_Show I would have watched but the folks at @apple have a jihad against adobe flash. Plse consider a YouTube link in future on UR site
neutral,"RT @rdingwell: .@Apple has a record quarter and because a bunch of professional guessers (aka analysts) wanted more, its a disappointmen ..."
neutral,"Hey @apple, androids releasing brand new state of the art phones, whens your new phone come out? What's that? (cont) http://t.co/2sko9l3d"
neutral,".@Apple has a record quarter and because a bunch of professional guessers (aka analysts) wanted more, its a disappointment #wtf"
neutral,@Apple how fun wouldn't it be if it was possible to integrate  ( soon to be named ) with notifications?
neutral,"Interesting read on war b/w @Apple & @Samsung- http://t.co/Vt9d24Yi -using latter, agree lack of innovation, but better specs at same price!"
neutral,RT @adamnash: The takeaway from the @Apple earnings call?  Even Apple needs a new iPhone release every 12 months to stay competitive. cc ...
neutral,The takeaway from the @Apple earnings call?  Even Apple needs a new iPhone release every 12 months to stay competitive. cc: @hblodget
neutral,Today's headline: @apple reports lower 4Q earnings. Headline in 3 months: @Apple reports record Q1 earnings.
neutral,"Win an @Apple iPod Touch from @Mommy_gaga, get the @Pampers Hello World Baby Memories App! http://t.co/XVcch6Os #PampersHelloApps"""
neutral,@apple expanded the app store to more than 20 new countries in the december quarter
neutral,@Apple will be rolling out iPhone 4S to more than 20 more countries by the end of the month.
neutral,Is it JUST a coincidence that @Apple named their virtual assistant after Tom and Katie's robot daughter?
neutral,Good or Bad results for @Apple ? Depends on who you ask apparently http://t.co/yDH8ffxE
neutral,Interesting times when increasing your revenue from $20B to $28B in a recession is considered a disappointment. @apple
neutral,People are waiting in line @apple for phones at 1:30 on a Tuesday! Don't you people have Jobs(no pun intended?)???
neutral,"@Apple Would much rather get outta this having a ( see pic ) and have fun with this "" Have your friends choose music"" http://t.co/7IiHbr4J"
neutral,RT @CRMStrategies: Great Tech War of 2012 http://t.co/64jGRoBp @FastCompany profiles @Amazon @Apple @Google @Facebook on @CNBC /ht @phil ...
neutral,@apple gonna see if anyone stayed logged into their fb or twitter #TroubleMaker
neutral,"If you've been struggling to get hold of me, I'm back online with a new iPhone - thanks @apple"
neutral,"Hey @Apple, pretty much all your products are amazing. You blow minds every time you launch a new gizmo. That said, your hold music is crap."
neutral,Great Tech War of 2012 http://t.co/64jGRoBp @FastCompany profiles @Amazon @Apple @Google @Facebook on @CNBC /ht @philsimon
neutral,@Jake_Gyllenhaal So you've made up with @Apple?
neutral,@Apple has a pic of Steve Jobs on their home page. #Honor
neutral,"@Apple to shut stores!!! C'mon, Only Wednesday for @SteveJobs memorial."
neutral,@Motorola is the Best Android-powered company that is going against @Apple.
neutral,@apple #readyfor5.0.1 http://t.co/M2FqakYr
neutral,This is what I have been waiting for RT @Apple The last big project Steve Jobs was working on was the new cranial insertion device: iMplant.
neutral,Apple Users Get The official Kalifornia Cavi App on your Apple Device now on  - powered by @Apple - Download it free http://t.co/HlGnvlRw
neutral,The official Kalifornia Cavi Mobil App is now available on the app store - powered by @Apple - Download it free http://t.co/HlGnvlRw
neutral,"#Win an @Apple iPod Touch from @Mommy_gaga, get the @Pampers Hello World Baby Memories App! http://t.co/I6woujUh #PampersHelloApps"
