negative,"the plot is nothing but boilerplate clichés from start to finish , and the script assumes that not only would subtlety be lost on the target audience , but that it's also too stupid to realize that they've already seen this exact same movie a hundred times"
negative,terminally brain dead production .
negative,"some episodes work , some don't ."
negative,beautifully filmed and well acted . . . but admittedly problematic in its narrative specifics .
negative,"j . lo will earn her share of the holiday box office pie , although this movie makes one thing perfectly clear : she's a pretty woman , but she's no working girl ."
negative,"rymer doesn't trust laughs -- and doesn't conjure proper respect for followers of the whole dead-undead genre , who deserve more from a vampire pic than a few shrieky special effects ."
negative,"not only are the film's sopranos gags incredibly dated and unfunny , they also demonstrate how desperate the makers of this 'we're -doing-it-for -the-cash' sequel were ."
negative,wow . i have not been this disappointed by a movie in a long time .
negative,"off the hook is overlong and not well-acted , but credit writer-producer-director adam watstein with finishing it at all ."
negative,it's a drag how nettelbeck sees working women -- or at least this working woman -- for whom she shows little understanding .
negative,"watching harris ham it up while physically and emotionally disintegrating over the course of the movie has a certain poignancy in light of his recent death , but boyd's film offers little else of consequence ."
negative,"it's also curious to note that this film , like the similarly ill-timed antitrust , is easily as bad at a fraction the budget ."
negative,"'ejemplo de una cinta en que no importa el talento de su reparto o lo interesante que pudo haber resultado su premisa , pues el resultado es francamente aburrido y , por momentos , deplorable . '"
negative,will probably be one of those movies barely registering a blip on the radar screen of 2002 .
negative,"the problem is not that it's all derivative , because plenty of funny movies recycle old tropes . the problem is that van wilder does little that is actually funny with the material ."
negative,there's nothing interesting in unfaithful whatsoever .
negative,none of this is half as moving as the filmmakers seem to think .
negative,a processed comedy chop suey .
negative,"as spent screen series go , star trek : nemesis is even more suggestive of a 65th class reunion mixer where only eight surviving members show up -- and there's nothing to drink ."
negative,"fails as a dystopian movie , as a retooling of fahrenheit 451 , and even as a rip-off of the matrix ."
negative,full of the kind of obnoxious chitchat that only self-aware neurotics engage in .
negative,"an erotic thriller that's neither too erotic nor very thrilling , either ."
negative,"the movie , like bartleby , is something of a stiff -- an extra-dry office comedy that seems twice as long as its 83 minutes ."
negative,with its parade of almost perpetually wasted characters . . . margarita feels like a hazy high that takes too long to shake .
negative,"if you value your time and money , find an escape clause and avoid seeing this trite , predictable rehash ."
negative,"the director and her capable cast appear to be caught in a heady whirl of new age-inspired good intentions , but the spell they cast isn't the least bit mesmerizing ."
negative,everything is pegged into the groove of a new york dating comedy with 'issues' to simplify .
negative,a dramatic comedy as pleasantly dishonest and pat as any hollywood fluff .
negative,"the cameo-packed , m : i-2-spoofing title sequence is the funniest 5 minutes to date in this spy comedy franchise . . . then mike myers shows up and ruins everything ."
negative,"it comes off as so silly that you wouldn't be surprised if ba , murdock and rest of the a-team were seen giving chase in a black and red van ."
negative,the 50-something lovebirds are too immature and unappealing to care about .
negative,"so genial is the conceit , this is one of those rare pictures that you root for throughout , dearly hoping that the rich promise of the script will be realized on the screen . it never is , not fully ."
negative,"even in the summertime , the most restless young audience deserves the dignity of an action hero motivated by something more than franchise possibilities ."
negative,"what with all the blanket statements and dime-store ruminations on vanity , the worries of the rich and sudden wisdom , the film becomes a sermon for most of its running time ."
negative,one lousy movie .
negative,"as gamely as the movie tries to make sense of its title character , there remains a huge gap between the film's creepy , clean-cut dahmer ( jeremy renner ) and fiendish acts that no amount of earnest textbook psychologizing can bridge ."
negative,"plodding , peevish and gimmicky ."
negative,"the four feathers is definitely horse feathers , but if you go in knowing that , you might have fun in this cinematic sandbox ."
negative,oozes condescension from every pore .
negative,"solaris "" is a shapeless inconsequential move relying on the viewer to do most of the work ."
negative,"the direction , by george hickenlooper , has no snap to it , no wiseacre crackle or hard-bitten cynicism ."
negative,. . . hypnotically dull .
negative,"though this saga would be terrific to read about , it is dicey screen material that only a genius should touch ."
negative,it has plenty of laughs . it just doesn't have much else . . . especially in a moral sense .
negative,"an awful lot like one of [spears'] music videos in content -- except that it goes on for at least 90 more minutes and , worse , that you have to pay if you want to see it ."
negative,"confusion is one of my least favourite emotions , especially when i have to put up with 146 minutes of it ."
negative,"[h]ad i suffered and bled on the hard ground of ia drang , i'd want something a bit more complex than we were soldiers to be remembered by ."
negative,"occasionally loud and offensive , but more often , it simply lulls you into a gentle waking coma ."
negative,it may play well as a double feature with mainstream foreign mush like my big fat greek wedding
negative,"by the time you reach the finale , you're likely wondering why you've been watching all this strutting and posturing ."
negative,"journalistically dubious , inept and often lethally dull ."
negative,putting the primitive murderer inside a high-tech space station unleashes a pandora's box of special effects that run the gamut from cheesy to cheesier to cheesiest .
negative,"at its best , it's black hawk down with more heart . at its worst , it's rambo- meets-john ford ."
negative,exactly what you'd expect from a guy named kaos .
negative,calculated swill .
negative,this movie . . . doesn't deserve the energy it takes to describe how bad it is .
negative,"with or without ballast tanks , k-19 sinks to a harrison ford low ."
negative,director oliver parker labors so hard to whip life into the importance of being earnest that he probably pulled a muscle or two .
negative,you might be shocked to discover that seinfeld's real life is boring .
negative,"it's not nearly as fresh or enjoyable as its predecessor , but there are enough high points to keep this from being a complete waste of time ."
negative,walsh can't quite negotiate the many inconsistencies in janice's behavior or compensate for them by sheer force of charm .
negative,this 10th film in the series looks and feels tired .
negative,"it leers , offering next to little insight into its intriguing subject ."
negative,i found myself growing more and more frustrated and detached as vincent became more and more abhorrent .
negative,one of the oddest and most inexplicable sequels in movie history .
negative,there's nothing to gain from watching they . it isn't scary . it hates its characters . it finds no way to entertain or inspire its viewers .
negative,"fear permeates the whole of stortelling , todd solondz' oftentimes funny , yet ultimately cowardly autocritique ."
negative,the skirmishes for power waged among victims and predators settle into an undistinguished rhythm of artificial suspense .
negative,thoroughly awful .
negative,". . . ice age treads predictably along familiar territory , making it a passable family film that won't win many fans over the age of 12 ."
negative,"though the film is well-intentioned , one could rent the original and get the same love story and parable ."
negative,just too silly and sophomoric to ensnare its target audience .
negative,"the video work is so grainy and rough , so dependent on being 'naturalistic' rather than carefully lit and set up , that it's exhausting to watch ."
negative,truly terrible .
negative,a cleverly crafted but ultimately hollow mockumentary .
negative,it gets bogged down by hit-and-miss topical humour before getting to the truly good stuff .
negative,"an achingly enthralling premise , the film is hindered by uneven dialogue and plot lapses ."
negative,"it's tommy's job to clean the peep booths surrounding her , and after viewing this one , you'll feel like mopping up , too ."
negative,"rifkin no doubt fancies himself something of a hubert selby jr . , but there isn't an ounce of honest poetry in his entire script ; it's simply crude and unrelentingly exploitative ."
negative,fluffy and disposible .
negative,such a bad movie that its luckiest viewers will be seated next to one of those ignorant pinheads who talk throughout the show .
negative,"if you go into the theater expecting a scary , action-packed chiller , you might soon be looking for a sign . an exit sign , that is ."
negative,"holds limited appeal to those who like explosions , sadism and seeing people beat each other to a pulp ."
negative,the dialogue is very choppy and monosyllabic despite the fact that it is being dubbed .
negative,"a feature-length , r-rated , road-trip version of mama's family ."
negative,what you end up getting is the vertical limit of surfing movies - memorable stunts with lots of downtime in between .
negative,"stealing harvard doesn't care about cleverness , wit or any other kind of intelligent humor ."
negative,"bigelow handles the nuclear crisis sequences evenly but milks drama when she should be building suspense , and drags out too many scenes toward the end that should move quickly ."
negative,"there's undeniable enjoyment to be had from films crammed with movie references , but the fun wears thin -- then out -- when there's nothing else happening ."
negative,"imagine kevin smith , the blasphemous bad boy of suburban jersey , if he were stripped of most of his budget and all of his sense of humor . the result might look like vulgar ."
negative,suffers from a lack of clarity and audacity that a subject as monstrous and pathetic as dahmer demands .
negative,"what soured me on the santa clause 2 was that santa bumps up against 21st century reality so hard , it's icky ."
negative,it's an 88-minute highlight reel that's 86 minutes too long .
negative,the film favors the scientific over the spectacular ( visually speaking ) .
negative,such an incomprehensible mess that it feels less like bad cinema than like being stuck in a dark pit having a nightmare about bad cinema .
negative,"with the exception of mccoist , the players don't have a clue on the park . the acting isn't much better ."
negative,the whole affair is as predictable as can be .
negative,a not-so-divine secrets of the ya-ya sisterhood with a hefty helping of re-fried green tomatoes .
negative,"this cloying , voices-from-the-other-side story is hell ."
negative,a suffocating rape-payback horror show that hinges on the subgenre's most enabling victim . . . and an ebullient affection for industrial-model meat freezers .
negative,"star trek was kind of terrific once , but now it is a copy of a copy of a copy ."
negative,"[n]o matter how much good will the actors generate , showtime eventually folds under its own thinness ."
negative,"every potential twist is telegraphed well in advance , every performance respectably muted ; the movie itself seems to have been made under the influence of rohypnol ."
negative,puts on airs of a hal hartley wannabe film -- without the vital comic ingredient of the hilarious writer-director himself .
negative,"ver wiel's desperate attempt at wit is lost , leaving the character of critical jim two-dimensional and pointless ."
negative,"despite a performance of sustained intelligence from stanford and another of subtle humour from bebe neuwirth , as an older woman who seduces oscar , the film founders on its lack of empathy for the social milieu - rich new york intelligentsia - and its off"
negative,"although disney follows its standard formula in this animated adventure , it feels more forced than usual ."
negative,gaghan . . . has thrown every suspenseful cliché in the book at this nonsensical story .
negative,"a sham construct based on theory , sleight-of-hand , and ill-wrought hypothesis ."
negative,[p]artnering murphy with robert de niro for the tv-cops comedy showtime would seem to be surefire casting . the catch is that they're stuck with a script that prevents them from firing on all cylinders .
negative,"'you'll laugh for not quite and hour and a half , but come out feeling strangely unsatisfied . you'll feel like you ate a reeses without the peanut butter . . . '"
negative,gooding offers a desperately ingratiating performance .
negative,"parker should be commended for taking a fresh approach to familiar material , but his determination to remain true to the original text leads him to adopt a somewhat mannered tone . . . that ultimately dulls the human tragedy at the story's core ."
negative,the director has injected self-consciousness into the proceedings at every turn . the results are far more alienating than involving .
negative,bogdanich is unashamedly pro-serbian and makes little attempt to give voice to the other side .
negative,"a lack of thesis makes maryam , in the end , play out with the intellectual and emotional impact of an after-school special ."
negative,the worst film of the year .
negative,by-the-numbers yarn .
negative,"without shakespeare's eloquent language , the update is dreary and sluggish ."
negative,"if h . g . wells had a time machine and could take a look at his kin's reworked version , what would he say ? 'it looks good , sonny , but you missed the point . '"
negative,"during the tuxedo's 90 minutes of screen time , there isn't one true 'chan moment' ."
negative,"bisset delivers a game performance , but she is unable to save the movie ."
negative,"watching austin powers in goldmember is like binging on cotton candy . it's sweet and fluffy at the time , but it may leave you feeling a little sticky and unsatisfied ."
negative,the most anti-human big studio picture since 3000 miles to graceland .
negative,the film can depress you about life itself .
negative,"i'm sure the filmmakers found this a remarkable and novel concept , but anybody who has ever seen an independent film can report that it is instead a cheap cliché ."
negative,the acting is fine but the script is about as interesting as a recording of conversations at the wal-mart checkout line .
negative,"its weighty themes are too grave for youngsters , but the story is too steeped in fairy tales and other childish things to appeal much to teenagers ."
negative,the plot plummets into a comedy graveyard before janice comes racing to the rescue in the final reel .
negative,"sometimes there are very , very good reasons for certain movies to be sealed in a jar and left on a remote shelf indefinitely ."
negative,"at 90 minutes this movie is short , but it feels much longer ."
negative,"here's my advice , kev . start reading your scripts before signing that dotted line ."
negative,an alternately raucous and sappy ethnic sitcom . . . you'd be wise to send your regrets .
negative,an ugly-duckling tale so hideously and clumsily told it feels accidental .
negative,"unfortunately , it's also not very good . especially compared with the television series that inspired the movie ."
negative,"it wraps up a classic mother/daughter struggle in recycled paper with a shiny new bow and while the audience can tell it's not all new , at least it looks pretty ."
negative,glazed with a tawdry b-movie scum .
negative,"this is the kind of movie during which you want to bang your head on the seat in front of you , at its cluelessness , at its idiocy , at its utterly misplaced earnestness ."
negative,"it winds up moving in many directions as it searches ( vainly , i think ) for something fresh to say ."
negative,"all in all , road to perdition is more in love with strangeness than excellence ."
negative,a big fat pain .
negative,a mimetic approximation of better films like contempt and 8 1/2 .
negative,"unintelligible , poorly acted , brain-slappingly bad , harvard man is ludicrous enough that it could become a cult classic ."
negative,"watching the powerpuff girls movie , my mind kept returning to one anecdote for comparison : the cartoon in japan that gave people seizures ."
negative,aan opportunity wasted .
negative,an inelegant combination of two unrelated shorts that falls far short of the director's previous work in terms of both thematic content and narrative strength .
negative,"to build a feel-good fantasy around a vain dictator-madman is off-putting , to say the least , not to mention inappropriate and wildly undeserved ."
negative,"with the cheesiest monsters this side of a horror spoof , which they isn't , it is more likely to induce sleep than fright ."
negative,"mild , meandering teen flick ."
negative,though its atmosphere is intriguing . . . the drama is finally too predictable to leave much of an impression .
negative,"though this rude and crude film does deliver a few gut-busting laughs , its digs at modern society are all things we've seen before ."
negative,"although it tries to be much more , it's really just another major league ."
negative,"astonishing isn't the word -- neither is incompetent , incoherent or just plain crap . indeed , none of these words really gets at the very special type of badness that is deuces wild ."
negative,one thing is for sure : this movie does not tell you a whole lot about lily chou-chou .
negative,"with a tone as variable as the cinematography , schaeffer's film never settles into the light-footed enchantment the material needs , and the characters' quirks and foibles never jell into charm ."
negative,"to better understand why this didn't connect with me would require another viewing , and i won't be sitting through this one again . . . that in itself is commentary enough ."
negative,"cuba gooding jr . valiantly mugs his way through snow dogs , but even his boisterous energy fails to spark this leaden comedy ."
negative,diane lane's sophisticated performance can't rescue adrian lyne's unfaithful from its sleazy moralizing .
negative,not at all clear what it's trying to say and even if it were – i doubt it would be all that interesting .
negative,storytelling feels slight .
negative,"[swimfan] falls victim to sloppy plotting , an insultingly unbelievable final act and a villainess who is too crazy to be interesting ."
negative,this remake of lina wertmuller's 1975 eroti-comedy might just be the biggest husband-and-wife disaster since john and bo derek made the ridiculous bolero .
negative,"silly , loud and goofy ."
negative,why spend $9 on the same stuff you can get for a buck or so in that greasy little vidgame pit in the theater lobby ?
negative,"the french director has turned out nearly 21/2 hours of unfocused , excruciatingly tedious cinema that , half an hour in , starts making water torture seem appealing ."
negative,the basic premise is intriguing but quickly becomes distasteful and downright creepy .
negative,the pool drowned me in boredom .
negative,it's like an all-star salute to disney's cheesy commercialism .
negative,"it's hard to imagine any recent film , independent or otherwise , that makes as much of a mess as this one ."
negative,"some of the computer animation is handsome , and various amusing sidekicks add much-needed levity to the otherwise bleak tale , but overall the film never rises above mediocrity ."
negative,"there's an excellent 90-minute film here ; unfortunately , it runs for 170 ."
negative,"as saccharine movies go , this is likely to cause massive cardiac arrest if taken in large doses ."
negative,"die another day is only intermittently entertaining but it's hard not to be a sucker for its charms , or perhaps it's just impossible not to feel nostalgia for movies you grew up with ."
negative,"as is often the case with ambitious , eager first-time filmmakers , mr . murray , a prolific director of music videos , stuffs his debut with more plot than it can comfortably hold ."
negative,"the mystery of enigma is how a rich historical subject , combined with so much first-rate talent . . . could have yielded such a flat , plodding picture ."
negative,"it throws quirky characters , odd situations , and off-kilter dialogue at us , all as if to say , "" look at this ! this is an interesting movie ! "" but the film itself is ultimately quite unengaging ."
negative,the inherent limitations of using a video game as the source material movie are once again made all too clear in this schlocky horror/action hybrid .
negative,bad company . bad movie . just plain bad .
negative,"it's not only dull because we've seen [eddie] murphy do the genial-rogue shtick to death , but because the plot is equally hackneyed ."
negative,avary's film never quite emerges from the shadow of ellis' book .
negative,"a poorly scripted , preachy fable that forgets about unfolding a coherent , believable story in its zeal to spread propaganda ."
negative,"while it is interesting to witness the conflict from the palestinian side , longley's film lacks balance . . . and fails to put the struggle into meaningful historical context ."
negative,"woo has as much right to make a huge action sequence as any director , but how long will filmmakers copy the "" saving private ryan "" battle scenes before realizing steven spielberg got it right the first time ?"
negative,"it's sincere to a fault , but , unfortunately , not very compelling or much fun ."
negative,". . . jones , despite a definitely distinctive screen presence , just isn't able to muster for a movie that , its title notwithstanding , should have been a lot nastier if it wanted to fully capitalize on its lead's specific gifts ."
negative,this follow-up seems so similar to the 1953 disney classic that it makes one long for a geriatric peter .
negative,"why , you may ask , why should you buy the movie milk when the tv cow is free ? there's no good answer to that one ."
negative,"this slow-moving swedish film offers not even a hint of joy , preferring to focus on the humiliation of martin as he defecates in bed and urinates on the plants at his own birthday party ."
negative,"a muddled limp biscuit of a movie , a vampire soap opera that doesn't make much sense even on its own terms ."
negative,"there's the plot , and a maddeningly insistent and repetitive piano score that made me want to scream ."
negative,this is a movie so insecure about its capacity to excite that it churns up not one but two flagrantly fake thunderstorms to underscore the action .
negative,this is amusing for about three minutes .
negative,"klein , charming in comedies like american pie and dead-on in election , delivers one of the saddest action hero performances ever witnessed ."
negative,"it's rare to see a movie that takes such a speedy swan dive from "" promising "" to "" interesting "" to "" familiar "" before landing squarely on "" stupid "" ."
negative,"this is the sort of low-grade dreck that usually goes straight to video --with a lousy script , inept direction , pathetic acting , poorly dubbed dialogue and murky cinematography , complete with visible boom mikes ."
negative,"the direction occasionally rises to the level of marginal competence , but for most of the film it is hard to tell who is chasing who or why ."
negative,there are few things more frustrating to a film buff than seeing an otherwise good movie marred beyond redemption by a disastrous ending .
negative,"it won't harm anyone , but neither can i think of a very good reason to rush right out and see it . after all , it'll probably be in video stores by christmas , and it might just be better suited to a night in the living room than a night at the movies ."
negative,looks more like a travel-agency video targeted at people who like to ride bikes topless and roll in the mud than a worthwhile glimpse of independent-community guiding lights .
negative,"given too much time to consider the looseness of the piece , the picture begins to resemble the shapeless , grasping actors' workshop that it is ."
negative,they kept much of the plot but jettisoned the stuff that would make this a moving experience for people who haven't read the book .
negative,just because a walk to remember is shrewd enough to activate girlish tear ducts doesn't mean it's good enough for our girls .
negative,"[carvey's] characters are both overplayed and exaggerated , but then again , subtlety has never been his trademark ."
negative,"it's mildly interesting to ponder the peculiar american style of justice that plays out here , but it's so muddled and derivative that few will bother thinking it all through ."
negative,this dreadfully earnest inversion of the concubine love triangle eschews the previous film's historical panorama and roiling pathos for bug-eyed mugging and gay-niche condescension .
negative,"brown's saga , like many before his , makes for snappy prose but a stumblebum of a movie ."
